{
  "schema_version": "1.0.0",
  "vector_suite": "fuzz-baseline",
  "spec_reference": "design-final.md §4.4, §4.5, §2.2",
  "spec_version": "round8-delta-applied",
  "generated_at": "2026-04-18T12:35:00Z",
  "coverage_summary": {
    "k8s-tier0-read": 10,
    "k8s-tier1-write-small": 8,
    "k8s-tier2-write-medium": 8,
    "k8s-tier3-destructive": 12,
    "k8s-tier4-broad": 6,
    "k8s-tier5-catastrophic": 4,
    "k8s-aggregation-traps": 4,
    "vault-tier0-read-metadata": 6,
    "vault-tier1-read-secret": 7,
    "vault-tier2-rotate": 4,
    "vault-tier3-revoke": 4,
    "vault-tier4-policy-change": 4,
    "vault-tier5-root": 4,
    "vault-sensitive-paths": 2,
    "db-tier0-read": 7,
    "db-tier1-bounded-write": 6,
    "db-tier2-unbounded-or-schema": 6,
    "db-tier3-structure-change": 6,
    "db-tier4-destructive": 4,
    "db-tier5-catastrophic": 2,
    "iam-tier0-read": 4,
    "iam-tier2-attach-policy-narrow": 4,
    "iam-tier3-attach-policy-broad": 4,
    "iam-tier4-role-create": 4,
    "iam-tier5-account-root": 4,
    "git-tier0-read": 4,
    "git-tier1-branch-write": 4,
    "git-tier2-main-write": 3,
    "git-tier3-history-rewrite": 4,
    "dns-and-cert": 15,
    "bypass-verb-obfuscation": 5,
    "bypass-unicode-homoglyph": 4,
    "bypass-argument-hiding": 6,
    "bypass-chained-commands": 4,
    "bypass-time-dispersed": 3,
    "bypass-multi-target": 4,
    "context-cold-start": 5,
    "context-canary-window": 5,
    "context-resource-state": 5
  },
  "notes": "Baseline fuzz corpus for classifier-WASM conformance per design-final.md §4.4. Every classifier shipped with a Tariff MUST pass these vectors before Tariff publish (V3-8 defense). Tier assignments are authoritative where the spec does not specify — rationales document judgment calls. Open spec questions are tagged in individual vector 'notes' fields. Several vectors intentionally test classifier escalation above Tariff floor: these check that classifiers implement §3.3 (stateful classifier with history) and §4.4 sensitive-path bumps. 'tier_floor_applied' in expected.output reflects the Tariff minimum_tiers value for the intent; 'tier' reflects the classifier's returned value. A vector is PASSED iff returned tier >= expected.output.tier AND (for escalation vectors) returned tier == expected.output.tier. Open spec questions (OQ-1 through OQ-8) are enumerated below; implementers should treat them as reasonable defaults until spec clarifies. OQ-1: Tier for 'list pods with fieldSelector spec.nodeName' — using Tier 0 as metadata read. OQ-2: Whether read of a secret with path matching 'prod/*' is Tier 2 or Tier 1+bump — chose Tier 2 (1 floor + 1 sensitive-path bump). OQ-3: Aggregation window default — assumed 300s for 5+ deletions. OQ-4: Whether 'drain node' is Tier 3 or Tier 4 — chose Tier 3 (recoverable via uncordon) but flagged. OQ-5: Canary-window tier bump — assumed +1 tier for all Tier 3+ within canary. OQ-6: Whether git push to default branch when default != main is Tier 2 — chose yes. OQ-7: DNS apex A-record rewrite — Tier 4 vs Tier 3; chose Tier 4 (business-irreversible for minutes). OQ-8: ACME wildcard cert issuance — Tier 3 vs Tier 2; chose Tier 3 (broad blast radius).",
  "vectors": [
    {
      "id": "fuzz-001",
      "category": "k8s-tier0-read",
      "description": "Simple pod list is Tier 0 read",
      "input": {
        "integration": "kubernetes",
        "raw_intent": {"verb": "list", "resource_kind": "pod", "namespace": "default"},
        "context": {"recent_actions": [], "resource_state_snapshot": null, "canary_window_active": false},
        "tariff_minimum_tiers": {"kubernetes:list:pod": 0}
      },
      "expected": {"outcome": "accept", "output": {"tier": 0, "tier_floor_applied": 0, "justification_tag": "read-only-metadata"}},
      "rationale": "§4.5 Tier 0: read-only metadata queries. No state change, no blast radius. list pod is canonical.",
      "redteam_refs": ["V3-8"],
      "severity_if_failed": "high"
    },
    {
      "id": "fuzz-002",
      "category": "k8s-tier0-read",
      "description": "Get specific pod by name is Tier 0",
      "input": {
        "integration": "kubernetes",
        "raw_intent": {"verb": "get", "resource_kind": "pod", "namespace": "default", "name": "nginx-abc123"},
        "context": {"recent_actions": [], "resource_state_snapshot": null, "canary_window_active": false},
        "tariff_minimum_tiers": {"kubernetes:get:pod": 0}
      },
      "expected": {"outcome": "accept", "output": {"tier": 0, "tier_floor_applied": 0, "justification_tag": "read-only-metadata"}},
      "rationale": "§4.5 Tier 0: get by name is read-only.",
      "redteam_refs": ["V3-8"],
      "severity_if_failed": "high"
    },
    {
      "id": "fuzz-003",
      "category": "k8s-tier0-read",
      "description": "Describe service is Tier 0",
      "input": {
        "integration": "kubernetes",
        "raw_intent": {"verb": "describe", "resource_kind": "service", "namespace": "kube-system", "name": "kube-dns"},
        "context": {"recent_actions": [], "resource_state_snapshot": null, "canary_window_active": false},
        "tariff_minimum_tiers": {"kubernetes:describe:service": 0}
      },
      "expected": {"outcome": "accept", "output": {"tier": 0, "tier_floor_applied": 0, "justification_tag": "read-only-metadata"}},
      "rationale": "§4.5 Tier 0: describe is a read operation.",
      "redteam_refs": ["V3-8"],
      "severity_if_failed": "high"
    },
    {
      "id": "fuzz-004",
      "category": "k8s-tier0-read",
      "description": "List deployments across all namespaces is Tier 0",
      "input": {
        "integration": "kubernetes",
        "raw_intent": {"verb": "list", "resource_kind": "deployment", "namespace": "*"},
        "context": {"recent_actions": [], "resource_state_snapshot": null, "canary_window_active": false},
        "tariff_minimum_tiers": {"kubernetes:list:deployment": 0}
      },
      "expected": {"outcome": "accept", "output": {"tier": 0, "tier_floor_applied": 0, "justification_tag": "read-only-metadata"}},
      "rationale": "§4.5 Tier 0: cluster-wide list is still read-only. Rate-matrix (§3.2) may apply separately.",
      "redteam_refs": ["V3-8"],
      "severity_if_failed": "high"
    },
    {
      "id": "fuzz-005",
      "category": "k8s-tier0-read",
      "description": "Get configmap (non-sensitive) is Tier 0",
      "input": {
        "integration": "kubernetes",
        "raw_intent": {"verb": "get", "resource_kind": "configmap", "namespace": "default", "name": "app-config"},
        "context": {"recent_actions": [], "resource_state_snapshot": null, "canary_window_active": false},
        "tariff_minimum_tiers": {"kubernetes:get:configmap": 0}
      },
      "expected": {"outcome": "accept", "output": {"tier": 0, "tier_floor_applied": 0, "justification_tag": "read-only-metadata"}},
      "rationale": "§4.5 Tier 0: configmap is non-sensitive by default.",
      "redteam_refs": ["V3-8"],
      "severity_if_failed": "high"
    },
    {
      "id": "fuzz-006",
      "category": "k8s-tier0-read",
      "description": "List nodes is Tier 0",
      "input": {
        "integration": "kubernetes",
        "raw_intent": {"verb": "list", "resource_kind": "node"},
        "context": {"recent_actions": [], "resource_state_snapshot": null, "canary_window_active": false},
        "tariff_minimum_tiers": {"kubernetes:list:node": 0}
      },
      "expected": {"outcome": "accept", "output": {"tier": 0, "tier_floor_applied": 0, "justification_tag": "read-only-metadata"}},
      "rationale": "§4.5 Tier 0: node listing is metadata-only.",
      "redteam_refs": ["V3-8"],
      "severity_if_failed": "high"
    },
    {
      "id": "fuzz-007",
      "category": "k8s-tier0-read",
      "description": "Get events in namespace is Tier 0",
      "input": {
        "integration": "kubernetes",
        "raw_intent": {"verb": "list", "resource_kind": "event", "namespace": "default"},
        "context": {"recent_actions": [], "resource_state_snapshot": null, "canary_window_active": false},
        "tariff_minimum_tiers": {"kubernetes:list:event": 0}
      },
      "expected": {"outcome": "accept", "output": {"tier": 0, "tier_floor_applied": 0, "justification_tag": "read-only-metadata"}},
      "rationale": "§4.5 Tier 0: event stream is read-only.",
      "redteam_refs": ["V3-8"],
      "severity_if_failed": "high"
    },
    {
      "id": "fuzz-008",
      "category": "k8s-tier0-read",
      "description": "Logs from a single pod is Tier 0",
      "input": {
        "integration": "kubernetes",
        "raw_intent": {"verb": "logs", "resource_kind": "pod", "namespace": "default", "name": "nginx-abc123"},
        "context": {"recent_actions": [], "resource_state_snapshot": null, "canary_window_active": false},
        "tariff_minimum_tiers": {"kubernetes:logs:pod": 0}
      },
      "expected": {"outcome": "accept", "output": {"tier": 0, "tier_floor_applied": 0, "justification_tag": "read-only-metadata"}},
      "rationale": "§4.5 Tier 0: log read is a read-only query. Implementers should consider logs-may-contain-secrets as a separate concern.",
      "redteam_refs": ["V3-8"],
      "severity_if_failed": "high"
    },
    {
      "id": "fuzz-009",
      "category": "k8s-tier0-read",
      "description": "Top pods (metrics) is Tier 0",
      "input": {
        "integration": "kubernetes",
        "raw_intent": {"verb": "top", "resource_kind": "pod", "namespace": "default"},
        "context": {"recent_actions": [], "resource_state_snapshot": null, "canary_window_active": false},
        "tariff_minimum_tiers": {"kubernetes:top:pod": 0}
      },
      "expected": {"outcome": "accept", "output": {"tier": 0, "tier_floor_applied": 0, "justification_tag": "read-only-metadata"}},
      "rationale": "§4.5 Tier 0: metrics-server query is read.",
      "redteam_refs": ["V3-8"],
      "severity_if_failed": "high"
    },
    {
      "id": "fuzz-010",
      "category": "k8s-tier0-read",